Pedro Ernesto Schiavinatti Tavares;;;;;;;;;;;;;;;analysis;;;;;;;observation, phase, thermodynamic;;;analysis;;;analysis;;;;;;;;;;;analysis, energy;;;;energy;;;;;;;energy;;;;measurement;analysis;;;;;;;;;;;;;;;;;;;;;;;;analysis, condensation;;;;;analysis, phase;;;;;
Priscila Hanako Ishy de Magalhães;;;;;;;;;;;literatura;;;;;;literatura;literatura;;;;;;;;;;;;;;;literatura;;;;;;;;literatura;;literatura;literatura;;;literatura;;;;;;rio;;literatura;literatura;alteridade, alteridade epistemológica, epistemológica, espaço, espaço alteridade, indígena, indígena espaço, literatura, literatura indígena, notas, notas literatura, rio, rio notas;;;;;;;;literatura;;;;;literatura;;notas;;;;;;;;;;;;rio;;literatura;;;
Regivaldo Sousa Ferreira;análise, aplicação, aplicação web, aprendizado, aprendizado máquina, apresentação, apresentação nuvem, ataques, ataques ddos, cibersegurança, cibersegurança detecção, clientes, clientes meio, conteúdos, dado, dado feedback, ddos, ddos meio, detecção, detecção ataques, feedback, feedback clientes, meio, meio aprendizado, meio apresentação, mineração, mineração dado, máquina, nuvem, nuvem palavras, palavras, web;;;análise, virtual;análise, sistema;;básica;análise;técnicas;;aprendizagem;;;;;paulo, via;análise;análise, desenvolvimento;;aplicação, paulo;acerca;study;análise, divulgação;análise, aprendizagem, desenvolvimento;sistema, study;;;aplicação, aprendizagem, clientes, monitoramento, técnicas;desenvolvimento, paulo, sistema;aplicação, desenvolvimento, educación, network, paulo, virtual;análise, ferramentas, sistema;ferramentas, paulo;aprendizagem;;;meio, paulo;paulo;aprendizado;análise, market, network, paulo, study;aprendizagem, escolar;escolar, paulo;análise, aprendizagem, desenvolvimento;paulo;acerca, análise, aplicação, desenvolvimento, educación, ferramentas, meio;;;;aprendizagem, meio;análise, paulo;aplicação;;dado;sistema;;análise, análise comparativa, comparativa, paulo, sistema, study;análise, dado;;escolar, palavras, paulo;básica, escolar, paulo;desenvolvimento, educación, escolar, ferramentas, market, paulo, study;paulo;;;paulo, study;paulo, sistema;;;;;aprendizado;básica, escolar, paulo;;;análise, escolar;ferramentas, paulo;herramienta, profesional, realidad, realidad virtual, virtual, virtual herramienta;study;;;básica;básica;análise;aplicação, monitoramento, network, study;aplicação, classificação, dado, desenvolvimento, ferramentas, study, técnicas;apresentação;paulo;;análise, análise dado, clientes, dado, desenvolvimento, ferramentas, meio, monitoramento, network, paulo, sistema, study, virtual;análise, ferramentas, paulo
Reinaldo da Silva Caraça;;;;;;;;;;;;;;;;efeitos;;;;;;;;;;;;;;;;;;;;;;;;;;;;;;;;;;;theory;;;;efeitos;efeitos;;;;;;;;;theory;;;;;;;;;;;;;;;;;;;;;;;;
Renato Cristiano Montanher;aprendizado;;ensino;ensino;;construção;mundo, relato;estratégia;ensino;complex, digital, ensino, experiência, pedagógica;literatura, revisão, revisão literatura;pensamento;complexo, línguas;;;;conhecimento, literatura;literatura, revisão, revisão literatura;;perspectiva;;;;construção, ensino, uso;auxiliar, utilizando;;ensino;digital, ensino, uso, utilizando;digital, jogo, jogos;comunicação, comunicação síncrona, conhecimento, conhecimento perspectiva, construção, construção conhecimento, digital, estratégia, estratégia comunicação, experiência, interatividade, interatividade construção, mundo, mundo relato, perspectiva, perspectiva mundo, relato, relato experiência, síncrona, síncrona interatividade, uso;digital, estratégia, revisão, utilizando;conhecimento, digital, estratégia;conhecimento, construção, construção conhecimento, ensino, ensino línguas, inglês, literatura, língua, línguas;;ensino;;ensino, experiência, uso, utilizando;abordagem, abordagem pedagógica, aprender, aprender inglés, aprendizado, aprendizado inglês, auxiliar, auxiliar aprendizado, complejo, complex, complex world, complexo, digital, digital aprender, inglés, inglés segunda, inglês, inglês segunda, jogo, jogo auxiliar, juego, juego digital, lengua, lengua utilizando, língua, língua utilizando, pedagógica, pedagógica pensamento, pensamento, pensamento complexo, pensamiento, pensamiento complejo, segunda, segunda lengua, segunda língua, utilizando, utilizando abordagem, utilizando pensamiento, world, world jogo;abordagem, digital, uso;;abordagem, construção, digital, ensino, inglês, literatura, língua, mundo;ensino;literatura, revisão, revisão sistemática, sistemática;construção, ensino, experiência, jogo, jogos, literatura, perspectiva, relato, relato experiência, revisão, utilizando;;;literatura;digital;utilizando;utilizando;uso;digital, experiência;experiência, uso;;ensino, literatura, revisão, revisão literatura, utilizando;conhecimento, literatura, revisão, uso;construção, ensino, estrangeira, experiência, inglês, literatura, língua, língua estrangeira, mundo, relato, relato experiência, world;ensino;ensino;construção, uso, utilizando;experiência;;;;abordagem, construção, literatura, perspectiva, revisão, revisão sistemática, sistemática, uso, utilizando;;literatura;aprendizado;;;ensino;ensino;experiência, relato, relato experiência, uso;ensino, perspectiva;digital, estratégia, perspectiva;;;construção;;;;conhecimento, construção, ensino, experiência, inglês, língua, relato, relato experiência, uso;comunicação, comunicação síncrona, conhecimento, conhecimento perspectiva, construção, construção conhecimento, estratégia, estratégia comunicação, experiência, interatividade, interatividade construção, mundo, mundo relato, perspectiva, perspectiva mundo, relato, relato experiência, síncrona, síncrona interatividade, uso;perspectiva, utilizando;experiência;literatura;utilizando;comunicação, conhecimento, construção, digital, estratégia, perspectiva, uso;conhecimento, digital, estratégia
Renato Marcon Pugliese;acesso;;ensino, ensino médio, história, médio;ensino;brasil, educação;educação, física;acesso, acesso permanência, básica, básica noroeste, cidade, discussões, discussões acesso, educação, educação básica, noroeste, noroeste paulistano, observatório, observatório políticas, paulistano, permanência, permanência educação, políticas, políticas públicas, públicas, públicas discussões;ciência;educação, ensino, ensino médio, médio, públicas, reflexões;docente, ensino, professor, realidade, reflexões;;;;;;educação, paulo;trabalho;brasil, carreira, docente, educação, políticas, recursos;;paulo;reflexões;;ciência;ensino, ensino médio, médio;;;ensino;ensino;federal, federal paulo, instituto, instituto federal, paulo;brasil, federal, federal paulo, instituto, instituto federal, paulo;brasil, setor;brasil, cidade, cidade paulo, história, paulo, políticas, políticas públicas, públicas;ensino, implicações, professor, reflexões;;ensino;paulo;ensino, paulo, políticas, políticas públicas, públicas;;paulo, trabalho;escolar;ensino, escolar, implicações, paulo, professor;educação, ensino;paulo;brasil, ciclo, ciência, educacionais, educação, ensino, federal, políticas, políticas públicas, públicas, realidade, trabalho;;;;brasil, recursos;cidade, cidade paulo, federal, federal paulo, instituto, instituto federal, metodológico, noroeste, paulo;;;ciência, públicos;setor;;brasil, cidade, cidade paulo, educação, ensino, federal, federal paulo, instituto, instituto federal, metodológico, noroeste, paulo, setor;brasil, cidade, educação, metodológico, necessidade;ensino, história;cidade, cidade paulo, ensino, escolar, paulo;básica, docente, educação, educação básica, ensino, escolar, federal, federal paulo, física, instituto, instituto federal, paulo;brasil, educação, escolar, federal, paulo, trabalho;brasil, paulo;;;paulo;cidade, paulo, trabalho;;;básica, escolar, paulo;;ensino;;brasil, ensino, políticas, trabalho;;educação, ensino, escolar, professor, reflexões;brasil, cidade, cidade paulo, educacionais, educação, paulo, políticas, políticas públicas, públicas;;;física;;básica;acesso, acesso permanência, básica, básica noroeste, discussões, discussões acesso, educação, educação básica, noroeste, noroeste paulistano, observatório, observatório políticas, paulistano, permanência, permanência educação, políticas, políticas públicas, públicas, públicas discussões;ensino, recursos;;setor, trabalho;história;atuais, autonomia, autonomia trabalho, carreira, carreira reflexões, dilemas, dilemas atuais, docente, docente instituto, federal, federal paulo, instituto, instituto federal, novo, paulo, paulo carreira, reflexões, reflexões dilemas, trabalho, trabalho docente;;acesso, brasil, cidade, cidade paulo, educacionais, educação, história, paulo, políticas;brasil, cidade, cidade paulo, história, paulo
Ricardo Normanha Ribeiro de Almeida;;;ensino;ensino;brasil, nacional, produção;;gênero, políticas;gênero, luta, possibilidades;ensino, impactos;culturais, ensino, formação, partir, possibilidades, produção, sob;;brasileiro;;;;;impactos, trabalho;brasil, políticas;;;;;partir, sob;atividade, ensino, formação, possibilidades;;;ensino;ensino;;brasil;brasil, produção;brasil, políticas;ensino;debate;brasileiro, ensino, formação;;ensino, formação, políticas;;brasileiro, impactos, indústria, trabalho;;culturais, ensino, formação;ensino, ensino superior, produção, superior;;brasil, contribuições, ensino, ensino superior, formação, nacional, políticas, relações, superior, trabalho;indústria;;;brasil, brasileiro, formas, luta, partir;;partir, produção;;mercado;produção;;brasil, ensino;brasil, formação, impactos;apontamentos, cinema, ensino, formação, notas, presente;ensino, partir;ensino, formação, relações;brasil, brasileiro, capital, indústria, mercado, mercado trabalho, superior, trabalho;brasil;;;;indústria, partir, produção, trabalho;;notas;;;ensino;brasil, ensino, políticas, trabalho;;;class, ensino, relações;brasil, impactos, políticas;;;;;;políticas;ensino, produção;;brasileiro, sob, trabalho;indústria;trabalho;;atividade, brasil, capital, impactos, políticas;brasil, formação, indústria
Rita Roberta Marioto;;;;;;;relato;;possíveis;digitais, experiência, tecnologias, tecnologias digitais;;;;;;;;;;;;;;uso;;;;uso;;digitais, digitais relato, escrita, escrita terceira, experiência, idade, idade uso, relato, relato experiência, tecnologias, tecnologias digitais, terceira, terceira idade, uso, uso tecnologias;;;aplicada, digitais, linguística, linguística aplicada;;;;aplicada, digitais, experiência, tecnologias, tecnologias digitais, uso, uso tecnologias;;tecnologias, uso;;digitais, escrita;;;aplicada, epistemologia, experiência, relato, relato experiência;;;;aplicada, digitais, linguística, linguística aplicada, possíveis;;;uso;experiência;experiência, tecnologias, uso;;;uso;experiência, relato, relato experiência;;;aplicada, uso;experiência;escrita;;;uso;;;;;experiência, relato, relato experiência, uso;;;;;;;;;;;;experiência, relato, relato experiência, uso;experiência, relato, relato experiência, uso;;experiência;;;uso;
Roberta Caetano Fleira;análise;;ensino, matemática;análise, ensino;análise, educação;educação;educação;análise;educação, ensino, reflexões;contexto, ensino, matemática, matemática reflexões, olhar, professor, professores, práticas, práticas professores, reflexões;;;;;;educação;análise, práticas;análise, educação, práticas, vida;;perspectiva;reflexões;;análise, olhar;análise, ensinando, ensino, matemática, professores, professores matemática, resolução;;;ensino, matemática;ensino;;inclusiva, perspectiva;análise;;alunos, ensino, professor, práticas, reflexões;;ensino, professores;;contexto, distância, distância olhar, ensino, matemática, olhar, professores, professores matemática;;análise, vida;escolar;ensino, escolar, professor, práticas;análise, educação, ensino, tea, vida;;análise, direito, educação, ensino, perspectiva, professores, práticas, relações;;;;contexto;alunos, análise;;contexto;;;;alunos, análise, educação, ensino, humana;análise, direito, educação;ensino, professores;direito, ensino, escolar, práticas;educação, ensino, escolar, relações;autista, educação, escolar, espectro, espectro autista, inclusão, tea;;;;;perspectiva;;;análise, escolar;;ensino, perspectiva;educação, ensino, escolar, professor, reflexões;class, ensino, relações;;;educação, perspectiva;;;;;;educação;análise, ensino;perspectiva;perspectiva;distância;olhar, reflexões;;análise, contexto, educação, perspectiva;análise
Robson Barbosa;sociais;;;;brasil, educação, gestão;educação;cidade, educação, políticas, políticas públicas, públicas, sociais;desafios, estratégia;educação, impactos, públicas;cenário, digital, internet;;;;;;educação, paulo;desafios, gestão, impactos;brasil, caso, educação, estudo, estudo caso, perspectivas, políticas, proposta;;controle, paulo, perspectiva;;;proposta;estudo;;;;digital, estudo, sociais;aplicativo, caso, computadores, desafios, digital, estudo, estudo caso, gestão, paulo, technology;aplicativo, brasil, caso, digital, estratégia, paulo, perspectiva;acessibilidade, acessibilidade legislação, aérea, bank, brasil, brasil estudo, caso, companhia, companhia aérea, conflitos, conflitos operacionais, consolidação, consolidação marca, cptm, digital, digital estratégia, documentos, documentos importância, estratégia, estratégia consolidação, estudo, estudo bank, estudo cptm, ferramentas, ferramentas marketing, gerenciamento, gerenciamento projetos, gestão, gestão conflitos, gestão documentos, importância, importância gerenciamento, legislação, legislação brasil, marca, marca estudo, marketing, marketing digital, operacionais, operacionais companhia, overbooking, overbooking gestão, projetos;acessibilidade, acessibilidade legislação, aumentando, aumentando resiliência, aérea, bank, brasil, brasil estudo, caso, caso centro, centro, centro recondicionamento, cidade, cidade paulo, cidades, cidades aumentando, circular, circular brasil, circular conceitos, circular políticas, companhia, companhia aérea, computadores, computadores economia, conceitos, conceitos perspectivas, conflitos, conflitos operacionais, consolidação, consolidação marca, contemporânea, controle, controle operações, cptm, desafios, desafios economia, digital, digital estratégia, documentos, documentos importância, economia, economia circular, energético, energético cidades, estratégia, estratégia consolidação, estudo, estudo bank, estudo caso, estudo cptm, ferramentas, ferramentas marketing, gerenciamento, gerenciamento projetos, gestão, gestão conflitos, gestão documentos, importância, importância gerenciamento, legislação, legislação brasil, legislação desafios, marca, marca estudo, marketing, marketing digital, operacionais, operacionais companhia, operações, overbooking, overbooking gestão, paulo, perspectivas, perspectivas sociedade, políticas, políticas públicas, projetos, públicas, públicas legislação, recondicionamento, recondicionamento computadores, resiliência, resiliência controle, risco, risco energético, sociedade, sociedade contemporânea;cenário, desafios, perspectivas, sociais;caso;;companhia, paulo;estudo, paulo, políticas, políticas públicas, proposta, públicas;digital;case, caso, digital, estudo, estudo caso, gestão, impactos, influence, operacionalização, paulo, technology;estudo;digital, paulo, perspectivas, sociais;educação, educação especial, especial;case, city, paulo;brasil, desafios, economia, educacionais, educação, estudo, ferramentas, gestão, perspectiva, políticas, políticas públicas, projetos, públicas;;;;brasil, caso, digital, estudo, estudo caso, proposta, sociais;cidade, cidade paulo, cidades, paulo;generation;caso, cenário, estudo, estudo caso;controle, digital, gestão;cidades, desafios, estudo;influence, quality;brasil, case, caso, cidade, cidade paulo, cidades, educação, especial, estudo, estudo caso, paulo;brasil, cidade, cidades, desafios, educação, estudo, gestão, impactos, importância, município, operações, projetos, resiliência, sociais;perception;cidade, cidade paulo, desafios, paulo;caso, educação, paulo, proposta;atendimento, brasil, case, city, desafios, educação, educação especial, especial, estudo, ferramentas, gestão, paulo, quality;brasil, caso, paulo;;;paulo;caso, cidade, controle, documentos, estudo, estudo caso, generation, gestão, paulo, perspectiva, perspectivas, proposta, technology;;;ferramentas, paulo;;digital, estratégia, perspectiva;brasil, cidade, cidade paulo, educacionais, educação, paulo, políticas, políticas públicas, públicas;brasil, impactos, políticas;;educação, perspectiva;;;;;influence;atendimento, atendimento estudo, caso, caso hospital, estudo, estudo caso, hospital, operacionalização, operacionalização atendimento;educação, políticas, políticas públicas, públicas;;case, estratégia, perspectiva;case, caso, estudo, estudo caso, ferramentas, gestão, hospital, perspectiva;perspectivas;paulo;;acessibilidade, acessibilidade legislação, altas, altas habilidades, arousal, arousal intention, atendimento, atendimento estudo, aérea, aérea políticas, bank, bank generation, brasil, brasil estudo, case, caso, caso hospital, centro, cidade, cidade paulo, cidades, cliente, cliente impactos, companhia, companhia aérea, conflitos, conflitos operacionais, consolidação, consolidação marca, controle, cptm, digital, digital estratégia, educacionais, educacionais perspectiva, educação, educação especial, especial, especial proposta, estratégia, estratégia consolidação, estudo, estudo bank, estudo caso, estudo cptm, ferramentas, ferramentas marketing, generation, generation technology, gestão, gestão altas, gestão conflitos, habilidades, habilidades superdotação, hospital, hospital overbooking, impactos, impactos sociais, influence, influence perception, instrumento, instrumento microcrédito, intention, iot, lealdade, lealdade cliente, legislação, legislação brasil, marca, marca estudo, marketing, marketing digital, microcrédito, microcrédito lealdade, museum, museum influence, operacionais, operacionais companhia, operacionalização, operacionalização atendimento, operações, overbooking, overbooking gestão, paulo, perception, perception quality, perspectiva, perspectiva educação, políticas, políticas educacionais, portal, portal gestão, projetos, proposta, proposta portal, quality, quality arousal, sociais, superdotação, technology, technology museum;acessibilidade, acessibilidade legislação, aumentando, aumentando resiliência, aérea, bank, brasil, brasil estudo, cidade, cidade paulo, cidades, cidades aumentando, companhia, companhia aérea, conflitos, conflitos operacionais, consolidação, consolidação marca, controle, controle operações, cptm, digital, digital estratégia, documentos, documentos importância, energético, energético cidades, estratégia, estratégia consolidação, estudo, estudo bank, estudo cptm, ferramentas, ferramentas marketing, gerenciamento, gerenciamento projetos, gestão, gestão conflitos, gestão documentos, importância, importância gerenciamento, legislação, legislação brasil, marca, marca estudo, marketing, marketing digital, operacionais, operacionais companhia, operações, overbooking, overbooking gestão, paulo, perspectivas, projetos, resiliência, resiliência controle, risco, risco energético
Rogério Aparecido Campanari Xavier;;;;virtual;;;;;;;;;;;;;;;;;;;;;;;;;;virtual;;;;;;;;;;;;;;;;;;;;;;;;;;;;;;;;;;;;;;herramienta, profesional, realidad, realidad virtual, virtual, virtual herramienta;;;;;;;;;;;;;;;;;;;;virtual;
Rogério Aparecido Pereira;;;;;;;;;;;;;;;;;;;;;;study;;;study, test;;;;;;;review;;;;;;;study;;;;review;;;strategy;;;;;;;;;study;;;;;study;;;;study;;;;study;;;;;;;;;;;;;;;study;study;;;;study;
Rogério Deitali Bruno;;;;;;construção, física;ifsp, âmbito;;;campus, pibid, âmbito;;;;;;ifsp;;curso;;ifsp;;;;construção;;;;processo;campus;construção;curso;;construção;;;;curso;;;;campus, construção, ifsp;campus;;construção, processo;;;;;campus, ifsp;;;;;;campus, ifsp;;campus, construção, curso, ifsp;processo;física;campus, construção, curso, ifsp;;;;ifsp;construção;;;;;construção;física;;;;;;;;;curso;;campus, construção, curso, ifsp, processo, processo construção;construção;âmbito;;;;campus, construção, ifsp;ifsp
Romario Araujo Pinheiro;;;;;;;;;;;;;;;analysis;harvesting, synthesis;;;hydrogen, performance;;;;;;analysis;;;analysis;;application;;method, performance;;;;;;;analysis, application, influence, performance;;;;;;;;;;;characterization, hydrogen;;;;influence, performance;analysis, application, based;;;;;method, performance;;;;application, characterization, deposited, film, screen, steel;;analysis, condensation;;;;;;;;;influence;;;;;;;;application, based, method;analysis;;;;based, influence;
Silene Jucelino de Lima;;;;;;;básica;;;;;;;;;;;caso, curso, estudo, estudo caso;;;;;;estudo;;;;estudo;caso, estudo, estudo caso;caso;caso, curso, estudo;caso, estudo, estudo caso;;caso;;;curso, estudo;;caso, estudo, estudo caso, operacionalização;estudo;;;;estudo;;;;caso, estudo, estudo caso;;;caso, estudo, estudo caso;;estudo;;caso, estudo, estudo caso;estudo;curso;;básica, caso;atendimento, curso, estudo;caso;;;;caso, estudo, estudo caso;;;básica;;;básica;;;;atendimento, atendimento estudo, caso, caso hospital, estudo, estudo caso, hospital, operacionalização, operacionalização atendimento;;;curso;;;básica;curso;;caso, estudo, estudo caso, hospital;;;;atendimento, atendimento estudo, caso, caso hospital, estudo, estudo caso, hospital, operacionalização, operacionalização atendimento;estudo
Tatiana Aparecida Picosque;acesso;;;;educação;educação;acesso, acesso permanência, básica, básica noroeste, discussões, discussões acesso, educação, educação básica, noroeste, noroeste paulistano, observatório, observatório políticas, paulistano, permanência, permanência educação, políticas, políticas públicas, públicas, públicas discussões;;educação, públicas;;;;;;;educação;;educação, políticas;;;;;;;;;;;;;;políticas, políticas públicas, públicas;;;;;políticas, políticas públicas, públicas;;;;;educação;;educação, políticas, políticas públicas, públicas;;;;;noroeste;;;;;;educação, noroeste;educação;;;básica, educação, educação básica;educação;;;;;;;;básica;;;acesso, acesso permanência, básica, básica noroeste, discussões, discussões acesso, educação, educação básica, noroeste, noroeste paulistano, observatório, observatório políticas, paulistano, permanência, permanência educação, políticas, políticas públicas, públicas, públicas discussões;políticas;;educação;educação, políticas, políticas públicas, públicas;;;;;básica;;;;;;;;acesso, educação, políticas;
Teresa Helena Buscato Martins;análise;;ensino;análise, ensino;análise, produção;construção, visão;ifsp, relato;análise;ensino;campus, ensino, experiência, produção;;;;;;ifsp, pirituba;análise, conhecimento;análise, curso, recursos;;ifsp, pirituba;;;análise;análise, análise uso, construção, ensino, uso, área;;;ensino;ensino, processo, uso, visão;campus;conhecimento, construção, experiência, relato, relato experiência, uso;análise, curso, produção;conhecimento;adaptação, conhecimento, construção, ensino, inglesa, inglês, língua, língua inglesa;;ensino;;currículo, curso, ensino, experiência, uso, área;inglês, língua;análise, uso, área;;campus, construção, didáticos, ensino, ifsp, ifsp campus, inglês, livros, livros didáticos, língua;análise, campus, ensino, pesquisa, produção;;análise, construção, ensino, experiência, pesquisa, processo, relato, relato experiência;;;;inglesa, linguísticos, recursos, recursos linguísticos;análise, campus, ifsp, pirituba, visão;produção;uso;experiência;experiência, produção, uso;;análise, campus, ensino, ifsp, pirituba, visão;análise, conhecimento, pirituba, uso;adaptação, adaptação curso, campus, construção, curso, curso idiomas, curso inglês, ead, ead formato, ensino, experiência, experiência curso, formato, formato ead, formato semipresencial, idiomas, idiomas língua, ifsp, ifsp campus, inglesa, inglês, inglês formato, língua, língua inglesa, relato, relato experiência, semipresencial, semipresencial relato;ensino, processo;ensino, pirituba;campus, campus pirituba, construção, curso, ifsp, pesquisa, pirituba, uso;experiência;;;ifsp, pirituba;construção, pesquisa, produção, uso;;;análise;;conhecimento, construção, ensino, experiência, inglês, língua, relato, relato experiência, uso;ensino, recursos;ensino, produção;experiência, relato, relato experiência, uso;análise, ensino;;;;campus, construção, curso, ifsp, processo, processo construção;;curso;;;conhecimento, construção, experiência, relato, relato experiência, uso, visão;pesquisa;experiência;;;análise, campus, campus pirituba, conhecimento, construção, ifsp, ifsp campus, pirituba, uso;análise, conhecimento, ifsp, pirituba
