Igor Calebe Zadi;aprendizado;;;;;;;;;complex, digital, pedagógica;;pensamento;complexo;;;;;;;;;;;;auxiliar, utilizando;;;digital, utilizando;digital, jogo;digital;digital, utilizando;digital;inglês, língua;;;;utilizando;;abordagem, digital;;abordagem, digital, inglês, língua;;;jogo, utilizando;;;;digital;utilizando;utilizando;;digital;;;utilizando;;inglês, língua, world;;;utilizando;;;;;abordagem, utilizando;;;aprendizado;;abordagem, abordagem pedagógica, aprender, aprender inglés, aprendizado, aprendizado inglês, auxiliar, auxiliar aprendizado, complejo, complex, complex world, complexo, digital, digital aprender, inglés, inglés segunda, inglês, inglês segunda, jogo, jogo auxiliar, juego, juego digital, lengua, lengua utilizando, língua, língua utilizando, pedagógica, pedagógica pensamento, pensamento, pensamento complexo, pensamiento, pensamiento complejo, segunda, segunda lengua, segunda língua, utilizando, utilizando abordagem, utilizando pensamiento, world, world jogo;;;;;digital;;;;;;;inglês, língua;;utilizando;;;utilizando;digital;digital
Igor Polezi Munhoz;análise, desempenho;;;análise, management;análise, educacional, gestão;;;análise;impactos;brazilian, digital, programa, tecnologias;management;brasileiro;educacional;;analysis, prediction;assessment, brazilian, paulo;análise, gestão, impactos, trabalho;análise, caso, estudo, estudo caso, organizacional, vida;performance, research, science;geração, paulo;;investment, study;análise, satisfação;análise, estudo, processos, uso, área;analysis, brazilian, processos, scenario, study;;;analysis, brazilian, digital, educacional, estudo, informações, proteção, uso;caso, digital, estudo, estudo caso, gestão, management, paulo, technology;application, caso, digital, geração, médicas, network, paulo, tecnologias, uso;análise, caso, comercial, digital, estudo, gestão, lean, metodologia;caso, digital, estudo, estudo caso, gestão, implantação, paulo, performance;;caso;brasileiro;paulo;educacional, estudo, paulo, programa, tecnologias, uso, área;abordagem, digital;;desempenho, estudo;abordagem, digital, education, paulo;análise, programa, vida;assessing, case, energy, mapping, paulo, sustainable;análise, desempenho, educacional, education, estudo, geração, gestores, gestão, metodologia, processos, relação, sustainability, trabalho, universidade;diferenças, indústria;company;;brasileiro, caso, digital, estudo, estudo caso;análise, paulo;energy, geração, processos;caso, estudo, estudo caso, proteção, uso;digital, gestão, relação;estudo, tecnologias, uso;influence, performance;analysis, análise, application, assessment, brazilian, case, case study, caso, educacional, estudo, estudo caso, informações, management, paulo, study, study brazilian;análise, estudo, gestão, impactos, organizacional, processos, relação, uso;;paulo;caso, paulo;agronegócio, applied, brasileiro, brazilian, case, company, education, estudo, gestão, importance, individual, indústria, innovation, inovação, management, market, patentes, paulo, performance, performance company, policy, relação, small, study, trabalho, universidade, uso;caso, inovação, paulo;;;application, paulo, study;abordagem, caso, eletrônica, estudo, estudo caso, gestão, implantação, industry, industry technology, indústria, management, manufacturing, paulo, qualidade, sustainability, technology, trabalho, uso;analysis, energy;;análise, market, network, paulo, study;;abordagem, digital, uso;paulo, trabalho;brasileiro, impactos, indústria, trabalho;tecnologias, uso;análise, vida;case, caso, digital, estudo, estudo caso, gestão, impactos, influence, operacionalização, paulo, technology;;study;;analysis, application, influence, performance;caso, estudo, estudo caso, operacionalização;;análise, uso, área;application, applied, case, cognitive, development, geração, network, proteção, research, scenario, study, uso;agronegócio, analysis, brasileiro, case, case study, caso, enterprise, estudo, estudo caso, gestão, inovação, qualidade, study, trabalho;indústria;paulo, trabalho;;análise, assessing, case, case study, caso, comercial, company, digital, estudo, estudo caso, gestão, green, impactos, implantação, influence, inovação, network, operacionalização, organizacional, paulo, policy, qualidade, relação, study, technology, uso;análise, digital, estudo, gestão, indústria, paulo, relação
Ingrid Anelise Lopes;desempenho;;;;;;;;estudantes;deficiência, escola, estudantes;aprendizagem;;;;;;;estudantes, estudo;;;;;escola;aprendizagem, estudo;;;;aprendizagem, estudo;estudo;municipal;estudo;estudo;aprendizagem, escola;;;;estudo;;desempenho, estudo;;escolar;aprendizagem, estudantes;;considerações, desempenho, estudantes, estudo;;;;aprendizagem, escola, estudo;;;estudo;;estudo;;considerações, estudo;estudo;;escolar;considerações, escolar;escolar, estudo, municipal;;;;;estudo;;;aprendizagem, escolar;;;escolar;;;escolar;estudo;;;;;estudo;;;;estudo;;;;estudo;estudo
Irando Alves Martins Neto;sociais;leitura;ensino;ensino;;construção;ifsp, livro, mundo, sociais;;ensino, escolarização;campus, culturais, didático, digitais, digital, ensino, formação, livro, livro didático, professor, práticas;literatura;crítico, letramento;;;;ifsp, paulo;literatura, práticas;literatura, perspectivas, práticas;;ifsp, paulo;;;;construção, ensino, formação;;;ensino;digital, ensino, sociais;campus, digital, paulo;construção, digitais, digital, escrita, mundo, paulo;digital;digital, paulo, perspectivas;construção, digitais, ensino, ensino inglês, implicações, inglês, literatura, língua, perspectivas, professor, práticas, sociais;;ensino, formação;leitura, paulo;digitais, ensino, formação, paulo;abordagem, digital, inglês, língua;abordagem, digital, education, paulo;escolar;;campus, didático, ensino;literatura, paulo;construção, crítica, education, ensino, estudos, formação, leitura, literatura, práticas;;;literatura;crítica, digitais, digital, sociais;campus, ifsp, paulo;;;digital;;;campus, ensino, ifsp, literatura, paulo;crítica, formação, letramento, literatura, sociais;campus, construção, ensino, formação, ifsp, ifsp campus, inglês, literatura, língua, mundo;ensino, escolar, paulo, práticas;ensino, escolar, formação, paulo;campus, construção, education, escolar, ifsp, paulo;paulo;escrita;woman;ifsp, paulo;abordagem, construção, literatura, paulo, perspectivas;;literatura;escolar, paulo;;abordagem, construção, digital, ensino, inglês, literatura, língua, mundo;ensino, escolar, implicações, paulo, professor;culturais, ensino, formação;digitais, escrita;ensino, escolar, professor, práticas;digital, paulo, perspectivas, sociais;;;campus, construção, ifsp;;;;campus, construção, didáticos, ensino, ifsp, ifsp campus, inglês, livros, livros didáticos, língua;construção, mundo;southern;perspectivas, século;literatura, paulo;;campus, construção, digital, ifsp, ifsp campus, literacy, paulo, sociais;digital, formação, ifsp, paulo, perspectivas
Jair Garcia dos Santos;análise;;ensino;análise, ensino;agenda, análise, educação, produção;educação;educação, projeto;análise;educação, ensino, estudantes;campus, didático, ensino, estudantes, produção, programa;aprendizagem;brasileira;;;;educação, implementação;análise;análise, desenvolvimento, educação, estudantes, vida;;;;;análise, projeto;análise, aprendizagem, desenvolvimento, dificuldades, ensino;;;ensino;aprendizagem, ensino;arte, campus, desenvolvimento, projeto;desenvolvimento, meta, projeto;análise, produção;projeto;aprendizagem, ensino;;ensino;;ensino, programa;;análise, programa, vida;aprendizagem, estudantes;campus, didático, ensino;;;análise, desenvolvimento, desenvolvimento sustentável, educação, ensino, ensino superior, estudantes, pesquisa, superior, sustentável;;;;agenda, aprendizagem;análise, campus;produção;;;produção, sustentável;;análise, arte, campus, educação, ensino, especial, implementação;análise, educação;campus, ensino;ensino;educação, ensino;campus, desenvolvimento, educação, educação especial, especial, pesquisa, superior, tea;;;;;pesquisa, produção;;;análise, aprendizagem, desenvolvimento;;ensino;educação, ensino;ensino, ensino superior, produção, superior;;análise, educação, ensino, tea, vida;educação, educação especial, especial;;;campus;;;educação;análise, campus, ensino, pesquisa, produção;projeto;desenvolvimento, implementação, pesquisa;brasileira;;;análise, campus, desenvolvimento, educação, educação especial, especial, projeto, revista;análise, projeto
Jairo Filho Sousa de Almeida Ferreira;;;;;;;;;;context, método, understanding;literatura, revisão;;;;;paulo;literatura;literatura, revisão;brazil, context;paulo;;;;;;;;;paulo;método, paulo;revisão;paulo, review;literatura;;;paulo;paulo;;assessing, case, energy, mapping, paulo, sustainable;;literatura, paulo;;;literatura, método, revisão;;;literatura;;climáticas, mudanças, mudanças climáticas, paulo;energy;;;;;brazil, case, climáticas, literatura, mudanças, mudanças climáticas, paulo, revisão;literatura, mudanças, planejamento, revisão;literatura, método;paulo;paulo;brazil, case, city, paulo;paulo;;;paulo;literatura, paulo, planejamento, revisão, revisão sistemática, sistemática, sistemática literatura, smart;energy;literatura;paulo;;literatura, revisão, revisão sistemática, sistemática;paulo;;;;case, city, paulo;;review;;;;;;case, método;brazil, case, risk;;literatura, paulo;;assessing, brazil, case, community, context, mudanças, paulo;paulo
Jeferson Antunes;análise, aplicação, desempenho, meio;leitura;ensino, integral;análise, ensino;análise, brasil, educacional, educação, gestão, nacional, política, política nacional, social;construção, educação;educação, grande, mulheres, política, políticas, políticas públicas, pública, públicas, relato;análise, ciência, desafios;educação, ensino, estudantes, públicas;contribution, ensino, estudantes, experiência, formação, método, professores, prática, práticas, realidade;literatura, revisão;;contribuição, educacional;;;ambiental, diagnóstico, educação, educação ambiental;análise, desafios, gestão, literatura, mulheres, práticas, trabalho;análise, brasil, desenvolvimento, educação, estudantes, estudo, humanos, integrativa, literatura, políticas, práticas, resultados, revisão, revisão integrativa;;aplicação, geração, perspectiva, renda;acerca;;análise, científica, ciência;análise, co, construção, desenvolvimento, ensino, estudo, formação, formação inicial, inicial, processos, professores;processos, utilizando;;ensino;aplicação, educacional, ensino, estudo, processo, utilizando;desafios, desafios gestão, desenvolvimento, estudo, federal, gestão, jogo, jogos, social;aplicação, atividades, brasil, construção, desenvolvimento, educación, experiência, federal, geração, método, perspectiva, relato, relato experiência, renda, social;análise, brasil, estudo, ferramentas, gestão, metodologia, projetos, revisão, utilizando;brasil, desafios, economia, estudo, ferramentas, gestão, políticas, políticas públicas, projetos, públicas;ano, aplicada, construção, desafios, discursos, ensino, literatura, práticas, pública;;ensino, formação, formação professores, professores;biblioteca, leitura, meio;aplicada, educacional, ensino, estudo, experiência, formação, formação professores, políticas, políticas públicas, professores, públicas, sustentabilidade, utilizando;jogo, utilizando;análise, desempenho, educacional, education, estudo, geração, gestores, gestão, metodologia, processos, relação, sustainability, trabalho, universidade;considerações, desempenho, estudantes, estudo;construção, crítica, education, ensino, estudos, formação, leitura, literatura, práticas;análise, desenvolvimento, desenvolvimento sustentável, educação, ensino, ensino superior, estudantes, pesquisa, superior, sustentável;literatura, método, revisão;;estratégias;;literatura;aplicada, brasil, crítica, direitos, direitos humanos, estudo, humanos, meio;análise, contribuição, federal, utilizando;aplicação, geração, processos, utilizando;estratégias, estudo;ciência, coletiva, experiência, gestão, relação, saúde;desafios, estudo, experiência, sustentável;;ambiental, ano, análise, brasil, considerações, contribuição, diagnóstico, educacional, educação, educação ambiental, ensino, estudo, federal, literatura, revisão, utilizando;análise, análise crítica, brasil, crítica, desafios, diagnóstico, direito, direitos, direitos humanos, educação, estratégias, estudo, formação, gestão, grande, humanos, literatura, processos, projetos, relação, revisão, revisões, saúde;construção, ensino, experiência, formação, formação professores, literatura, método, professores, relato, relato experiência, vivências;desafios, direito, ensino, mulheres, processo, práticas;considerações, educação, ensino, federal, formação, relações;aplicada, brasil, construção, criação, desafios, desenvolvimento, educación, education, educação, estudo, federal, ferramentas, gestão, pesquisa, relação, social, superior, trabalho, universidade, utilizando;brasil, experiência, extensão, política;mulheres;social;;construção, contribution, estudo, gestão, literatura, perspectiva, pesquisa, produtos, revisão, sustainability, sustentabilidade, trabalho, utilizando;;literatura;acerca, análise, aplicação, desenvolvimento, educación, ferramentas, meio;;construção, ensino, experiência, jogo, jogos, literatura, perspectiva, relato, relato experiência, revisão, utilizando;brasil, ciclo, ciência, educacionais, educação, ensino, federal, políticas, políticas públicas, públicas, realidade, trabalho;brasil, contribuições, ensino, ensino superior, formação, nacional, políticas, relações, superior, trabalho;aplicada, epistemologia, experiência, relato, relato experiência;análise, direito, educação, ensino, perspectiva, professores, práticas, relações;brasil, desafios, economia, educacionais, educação, estudo, ferramentas, gestão, perspectiva, políticas, políticas públicas, projetos, públicas;;;construção, processo;;estudo;educação, políticas, políticas públicas, públicas;análise, construção, ensino, experiência, pesquisa, processo, relato, relato experiência;aplicação, construção, experiência, geração, método, perspectiva, relato, relato experiência, renda;aplicação, criação, desenvolvimento, diagnóstico, estratégias, estudo, ferramentas, gestão, grande, perspectiva, pesquisa, política, pública, renda, trabalho, trabalho renda, utilizando;experiência;federal, literatura, trabalho;utilizando;ano, análise, brasil, construção, desenvolvimento, educacionais, educação, estudo, ferramentas, gestão, meio, perspectiva, políticas, projetos, relação, social;análise, brasil, estudo, ferramentas, formação, gestão, projetos, relação
José Geraldo Basante;;;;;;;;;;;;;;;;;corporativas;competências;;;;;;;;;;;;;;;;;;;;;diferenças, indústria;;;;;estratégias;;;;;;;estratégias;;;;;estratégias;;;;indústria;;;;;indústria;;;;;;;indústria;;;;;;;;;;;;estratégias;indústria;;;transparência;indústria
José Roberto Campanele;;;;;;;;;;;;;;;;;;;;;;;;;;;;;strategic;;;;;;;;;;company;;;;;;;;;;;;;;;;;;;;;company;;;;;strategic;;;;;;;;;;;;strategy;;;;;;;;;;;company;
Juliana de Souza Topan;;;;;;;;;;;literatura;;;;;;literatura;literatura;;;;;;;;;;;;;;;literatura;;;;;;;;literatura;;literatura;literatura;;;;;;;;;;;literatura;adultos, jovens, jovens adultos, literatura;literatura;;;;;;;;literatura;;literatura;;;literatura;;;;;;;;;;;;;;;;literatura;;;
Junot de Oliveira Maia;meio, redes, redes sociais, sociais;;;;agenda, brasil;;redes, redes sociais, sociais;luta;possíveis;contexto, digitais, digital, escola, paradigma, partir;aprendizagem;brasileiro;;;;;;brasil, caso, estudo, estudo caso, humanos, proposta, recursos;online;;;;escola, partir, proposta;aprendizagem, estudo;;;;aprendizagem, digital, estudo, redes, redes sociais, sociais;caso, digital, estudo, estudo caso;brasil, caso, digitais, digital;brasil, caso, digital, estudo;brasil, caso, digital, estudo, estudo caso;aplicada, aprendizagem, digitais, escola, inglesa, linguística, linguística aplicada, pesquisas, sociais;caso;brasileiro;meio;aplicada, contexto, digitais, estudo, proposta;digital;brasileiro, caso, digital, estudo, estudo caso;aprendizagem, escola, estudo;crítica, digitais, digital, sociais;agenda, aprendizagem;;aplicada, brasil, crítica, direitos, direitos humanos, estudo, humanos, meio;;;;;;partir;caso, contexto, estudo, estudo caso;digital;estudo;;brasil, caso, estudo, estudo caso;brasil, crítica, direitos, direitos humanos, estudo, humanos, sociais;inglesa;partir;caso, proposta;aplicada, brasil, brasileiro, estudo;brasil, caso;;;;caso, estudo, estudo caso, paradigma, partir, proposta;;;aprendizagem, meio;;digital;brasil, recursos;brasil, brasileiro, formas, luta, partir;aplicada, digitais, linguística, linguística aplicada, possíveis;contexto;brasil, caso, digital, estudo, estudo caso, proposta, sociais;;;;;caso, estudo, estudo caso;;inglesa, linguísticos, recursos, recursos linguísticos;;brasileiro, caso, estudo, estudo caso;;;;ampliação, brasil, caso, contexto, digital, estudo, estudo caso, meio, online, proposta, redes, redes sociais, sociais;brasil, digital, estudo
Júlio Samuel Sávio Bernardo;análise;;;análise;análise;visão;cidade, ifsp, noroeste, tempo;análise;;campus;;;contribuição;;;câmpus, câmpus paulo, ifsp, ifsp câmpus, paulo, paulo pirituba, pirituba;análise, áreas;análise;;câmpus, câmpus paulo, ifsp, paulo, paulo pirituba, pirituba;;;análise;análise, elaboração, espacial, áreas;utilizando;;;utilizando, visão;campus, federal, federal paulo, instituto, instituto federal, paulo;federal, federal paulo, instituto, instituto federal, paulo, protocolo;análise, utilizando;cidade, cidade paulo, cidades, paulo;alunos;;;paulo;paulo, utilizando;utilizando;análise, paulo;;campus, ifsp, paulo;análise, campus;climáticas, mudanças, mudanças climáticas, paulo;análise, contribuição, federal, utilizando;;;;;;caracterização, utilizando;;tempo;cidades;;alunos, alunos análise, análise, análise benefícios, análise espacial, benefícios, benefícios socioeconômicos, campus, campus paulo, caracterização, caracterização áreas, cidade, cidade paulo, cidades, cidades sustentáveis, climáticas, conservação, conservação áreas, contribuição, contribuição cidades, câmpus, câmpus paulo, elaboração, elaboração protocolo, entorno, entorno ifsp, espacial, espacial conservação, federal, federal paulo, geotecnologias, ifsp, ifsp câmpus, ifsp visão, instituto, instituto federal, metodológico, metodológico análise, mudanças, mudanças climáticas, noroeste, noroeste cidade, paulo, paulo contribuição, paulo ifsp, paulo pirituba, pirituba, pirituba ifsp, pirituba instituto, pirituba utilizando, proporcionados, proporcionados campus, protocolo, protocolo metodológico, região, região noroeste, socioeconômicos, socioeconômicos proporcionados, sustentáveis, sustentáveis tempo, tempo, tempo mudanças, utilizando, utilizando geotecnologias, verdes, verdes entorno, verdes região, visão, visão alunos, áreas, áreas verdes;análise, cidade, cidades, metodológico, mudanças, pirituba;campus, ifsp, tempo;cidade, cidade paulo, paulo;câmpus, câmpus paulo, federal, federal paulo, instituto, instituto federal, paulo, paulo pirituba, pirituba;campus, federal, ifsp, paulo, pirituba, região, utilizando;paulo;;;caracterização, câmpus, câmpus paulo, ifsp, ifsp câmpus, paulo, paulo pirituba, pirituba, verdes, áreas, áreas verdes;cidade, paulo, região, utilizando;;;análise, paulo;;utilizando;cidade, cidade paulo, federal, federal paulo, instituto, instituto federal, metodológico, noroeste, paulo;;;alunos, análise;cidade, cidade paulo, cidades, paulo;;;campus, ifsp;;;noroeste;análise, campus, ifsp, pirituba, visão;visão;utilizando;;federal, federal paulo, instituto, instituto federal, paulo;utilizando;análise, campus, cidade, cidade paulo, cidades, ifsp, mudanças, paulo, pirituba;análise, cidade, cidade paulo, cidades, ifsp, paulo, pirituba, região
Kamili Oliveira Santana;aplicação;;;;produção;;cultura;;;partir, produção;;;;sp;;crude;;;hydrogen, production;aplicação, geração;;process, production;partir;processos;processos, utilizando;;;aplicação, utilizando;;aplicação, cultura, geração;produção, utilizando;;;;;;utilizando;utilizando;energy, geração, processos;;;produção;energy;aplicação, geração, processos, utilizando;;;;partir;caracterização, utilizando;;;;produção;used;aplicadas, caracterização, utilizando;aplicadas, consumo, cultura, processos, sp;;partir;;aplicadas, cultura, utilizando;;;;caracterização, characterization;generation, partir, produção, sp, utilizando;energy;;aplicação;;utilizando;;partir, produção;;;generation;;;;characterization, hydrogen;;;produção;aplicação, geração;aplicação, utilizando;;;utilizando;cultura, generation;consumo
Krícia Helena Barreto;;;;;;;;;;cenário, contexto;expression;;;;;;;caso, estudo, estudo caso;;;;;;estudo, uso;;;;estudo, proteção, uso;caso, estudo, estudo caso;caso, uso;caso, estudo;caso, estudo, estudo caso;cenário;caso;;;contexto, estudo, uso;;caso, estudo, estudo caso, proteção, uso;estudo;;;;estratégias, estudo;estratégias;;;caso, contexto, estudo, estudo caso;;;;face;estudo, uso;;caso, estudo, estudo caso;estratégias, estudo, uso;daniel;;caso;estudo, uso;caso;;;;caso, estudo, estudo caso, theory, uso;;;;theory;uso;;;uso;contexto;caso, cenário, estudo, estudo caso;;;;;caso, estudo, estudo caso;;uso;proteção, uso;caso, estratégias, estudo, estudo caso;;;;caso, contexto, estudo, estudo caso, uso;estudo
Leandro Módolo Paschoalotte;dado;nova;;;financeira, gestão;nova;tempo;ciência;pandemia;digital, experiência, pandemia;;;;;;;gestão, pandemia;;;artificial, controle;;;ciência;questão, questões;;;;artificial, digital, health, inteligência, inteligência artificial;digital, gestão;digital, experiência;digital, gestão, serviços;controle, digital, gestão;;;;;experiência;digital;digital, gestão, relação;;digital;;;ciência, coletiva, experiência, gestão, relação, saúde;;;;digital;tempo;;face;;experiência;;pandemia, tempo;dado, gestão, medicina, relação, saúde, serviços, serviços saúde;algorítmica, experiência, pandemia, questões, tempo;;questão;artificial, gestão, inteligência, inteligência artificial, mercado, nova, relação;experiência, serviços;;;;controle, gestão;;;dado;;digital, experiência;ciência, públicos;mercado;experiência;;controle, digital, gestão;;;;;;;experiência;artificial, experiência;dado, gestão;além, experiência;;;automation, automação, controle, dado, digital, gestão, relação, serviços;controle, digital, gestão, relação
Lincon Lopes;;;;;produção, sistema;;;desafios, discussão;;experiência, produção, tecnologias;;;;;;conceito;desafios;estudo;;;;;;estudo, uso;sistema;;;estudo, uso;desafios, estudo, sistema;experiência, tecnologias, uso;aquisições, aquisições setor, bancário, bancário estudo, crise, crise sistema, década, década marcada, estudo, estudo eventos, eventos, eventos década, financeiro, financeiro internacional, fusões, fusões aquisições, internacional, marcada, marcada crise, produção, setor, setor bancário, sistema, sistema financeiro;cidades, desafios, estudo;desafios;;conceito;;estudo, experiência, tecnologias, uso;;estudo, tecnologias, uso;estudo;;produção, sustentável;;desafios, estudo, experiência, sustentável;;;;estudo;cidades;produção;estudo, uso;experiência;;;cidades, estudo, setor, sistema;cidades, cidades inteligentes, civil, desafios, estudo, inteligentes, uso;experiência, rio;desafios;;desafios, estudo, uso;discussão, experiência;;;;estudo, produção, sistema, uso;;rio;sistema;;experiência, uso;setor;produção;experiência, tecnologias, uso;;cidades, desafios, estudo;;;;;estudo;;experiência, produção, uso;experiência, uso;estudo, rio, setor;década, experiência;;;aplicado, aplicado conceito, cidades, cidades inteligentes, civil, conceito, conceito cidades, estudo, geoanalytics, geoanalytics aplicado, inteligentes, sistema, uso;cidades, cidades inteligentes, estudo, inteligentes
Lucas Rodrigues dos Santos;system;;;evaluation;;;;;;system;system;;;;;evaluation;;;performance;;;evaluation;;;;;;;;;;evaluation, performance;;;;;;;influence, performance;;;;;;;;;;;used;;;;;potential;;;;;performance, quality, system;;;;system;survey, system;measurement;;;;;;;;;influence, quality;;;;influence, performance;;;;;;;;;evaluation, influence, quality;
