;Adriano Jose Ferruzzi;Alessandra da Silva Carneiro;Alessandro Emilio Teruzzi;Alex Sandro Rodrigues Ancioto;Alexandre José Romagnoli;Alexandre Machado Rosa;Ana Carolina Vila Ramos dos Santos;Ana Claudia Folha da Cruz;Ana Márcia Lima Costa;Ana Paula Rodrigues Magalhães de Barros;André Luiz Favareto;Andréa Antonieta Cotrim Silva;Ariane Macedo Melo Ferraz;Beatriz Ferraz Diniz;Bruno Secco Faquin;Bruno Sérgio do Amaral;Bárbara Beatriz Freitag;Carolina Aparecida de Freitas Dias;Caroline Inês Lisevski;Claudia Almerinda de Souza Oliveira;Danilo Marcondes de Alcantara;Davi Munhoz Benati;Elisangela Lizardo de Oliveira;Emanoel Fabiano Menezes Pereira;Eudes Müller D'Oliveira Santos;Eufrida Pereira da Silva;Everaldo Paulo da Silva;Fabio Oliveira Teixeira;Felipe Alexandre Cardoso Pazinatto;Felipe Rodrigues Martinez Basile;Fernando Cesar Mendonca;Fernando Luis Rossi;Fernando da Silva Pardo;Filipe Mantovani Ferreira;Flávia Roberta Torezin;Hadassa Viviane Rodrigues;Idalise Bernardo Bagé;Igor Calebe Zadi;Igor Polezi Munhoz;Ingrid Anelise Lopes;Irando Alves Martins Neto;Jair Garcia dos Santos;Jairo Filho Sousa de Almeida Ferreira;Jeferson Antunes;José Geraldo Basante;José Roberto Campanele;Juliana de Souza Topan;Junot de Oliveira Maia;Júlio Samuel Sávio Bernardo;Kamili Oliveira Santana;Krícia Helena Barreto;Leandro Módolo Paschoalotte;Lincon Lopes;Lucas Rodrigues dos Santos;Luciana Cavalcanti Maia Santos;Luciano Henrique Trindade;Marcelo Cizaurre Guirau;Maria Cristina Stello Leite;Moacir Silva de Castro;Nelio Fernando dos Reis;Nilton Pereira dos Santos;Patricia Horta;Patricia de Aquino Prudente;Patrícia Cristiane Santana da Silva;Paulo Eduardo Pissardini;Pedro Ernesto Schiavinatti Tavares;Priscila Hanako Ishy de Magalhães;Regivaldo Sousa Ferreira;Reinaldo da Silva Caraça;Renato Cristiano Montanher;Renato Marcon Pugliese;Ricardo Normanha Ribeiro de Almeida;Rita Roberta Marioto;Roberta Caetano Fleira;Robson Barbosa;Rogério Aparecido Campanari Xavier;Rogério Aparecido Pereira;Rogério Deitali Bruno;Romario Araujo Pinheiro;Silene Jucelino de Lima;Tatiana Aparecida Picosque;Teresa Helena Buscato Martins;Thiago Pedro Donadon Homem;Thiago Silva Broze;Valdir Donizete dos Santos Junior;Vanessa Regina Ferreira da Silva;Whisner Fraga Mamede;Wilian Ramalho Feitosa;William Rosseti
Adriano Jose Ferruzzi;;;;análise;análise;;acesso, redes, redes sociais, sociais;análise;;system;ambientes, system;;;;;cell;análise;análise;;aplicação;;;análise;análise;;;;aplicação, clientes, redes, redes sociais, sociais;computação;aplicação;análise;;ambientes, sociais;;;meio;;aprendizado;análise, desempenho;desempenho;sociais;análise;;análise, aplicação, desempenho, meio;;;;meio, redes, redes sociais, sociais;análise;aplicação;;dado;;system;análise, comportamento;análise, dado, sociais;;palavras;;information, system;;;;system;comportamento, information, system;;;análise, aplicação, aplicação web, aprendizado, aprendizado máquina, apresentação, apresentação nuvem, ataques, ataques ddos, cibersegurança, cibersegurança detecção, clientes, clientes meio, conteúdos, dado, dado feedback, ddos, ddos meio, detecção, detecção ataques, feedback, feedback clientes, meio, meio aprendizado, meio apresentação, mineração, mineração dado, máquina, nuvem, nuvem palavras, palavras, web;;aprendizado;acesso;;;análise;sociais;;;;;;acesso;análise;aplicação;aplicação, dado;apresentação;;;acesso, análise, clientes, dado, meio, redes, redes sociais, sociais;análise
Alessandra da Silva Carneiro;;;;;;nova;mulher;;;;;;;;;;;;;;;;;;;;;;;;;;;;;leitura;;;;;leitura;;;leitura;;;;;;;;nova;;;;;;;;nova;;;;;;;;;;;;;;;;;;;;;;;;;;;;;
Alessandro Emilio Teruzzi;;;;ensino;ideias;;;;ensino, ensino médio, médio;ensino, matemática;;;;;;;;;;;;;;ensino, ensino médio, matemática, médio;;;cálculo, ensino, matemática;ensino;tecnologia;;;história;ensino;;ensino;;ensino, matemática;;;;ensino;ensino;;ensino, integral;;;;;;;;;;;ensino;;ensino, história;ensino;ensino;tecnologia;;;;;tecnologia;;;;;ensino;ensino, ensino médio, história, médio;ensino;;ensino, matemática;;;;;;;;ensino;;;história;;;história;história
Alex Sandro Rodrigues Ancioto;análise;;ensino;;análise;;;análise;ensino;ensino, teaching;management;;;;;evaluation, magnetic;análise;análise;simulador;;;evaluation;análise;análise, aspectos, ensino;;;ensino;ensino;management;virtual;análise;algorithm, evaluation, scheduling;ensino;;ensino;;ensino;;análise, management;;ensino;análise, ensino;;análise, ensino;;;;;análise;;;;;evaluation;análise, ensino, management;análise;ensino;ensino;ensino;management;;;;;management;;;análise, virtual;;ensino;ensino;ensino;;análise, ensino;;virtual;;;;;;análise, ensino;simulator;;;;;análise, evaluation, virtual;análise
Alexandre José Romagnoli;análise;;ideias;análise;;educação, papel;educação, política;análise;educação;produção;;;educacional;;;educação;análise, gestão;análise, brasil, educação;;;;;análise;análise;sistema;;;educacional;gestão, papel, sistema, social;brasil, social;análise, brasil, ferramenta, gestão, papel, produção, sistema;brasil, gestão;;;interesse;;educacional;;análise, educacional, gestão;;;agenda, análise, educação, produção;;análise, brasil, educacional, educação, gestão, nacional, política, política nacional, social;;;;agenda, brasil;análise;produção;;financeira, gestão;produção, sistema;;análise, brasil, educacional, educação, sistema;análise, brasil, educação, ferramenta, gestão, indicadores;;;educação;brasil, educação, gestão, indicadores, social;brasil, política, rural;;social;;gestão, produção, sistema;;;análise, sistema;;;brasil, educação;brasil, nacional, produção;;análise, educação;brasil, educação, gestão;;;;;;educação;análise, produção;;ferramenta, gestão, papel, política;disputa;;;análise, brasil, educação, gestão, papel, sistema, social;análise, brasil, gestão
Alexandre Machado Rosa;;nova;;;educação, papel;;educação, raça;;educação;;;;;;;educação;;educação;;;;;;construção;;;;visão;papel;construção;papel;;construção;;;;;;;;construção;educação;;construção, educação;;;;;visão;;;nova;;;educação, visão;educação;construção;;educação, física;construção, educação, nova;;;;;construção;;;;;construção;educação, física;;;educação;educação;;;construção, física;;;educação;construção, visão;construção, visão;papel;nação;;;construção, educação, papel;
Ana Carolina Vila Ramos dos Santos;acesso, redes, redes sociais, sociais;mulher;;;educação, política;educação, raça;;gênero, periferia;educação, públicas;livro, âmbito;;feminino;;;;educação, ifsp;mulheres;educação, feminino, políticas;;feminino, ifsp;violência;;projeto;;;;;redes, redes sociais, sociais;projeto;cultura, feminino, mundo, projeto, relato;;cidade, políticas, políticas públicas, projeto, públicas;música, pública, sociais;;;;políticas, políticas públicas, públicas;;;;ifsp, livro, mundo, sociais;educação, projeto;;educação, grande, mulheres, política, políticas, políticas públicas, pública, públicas, relato;;;;redes, redes sociais, sociais;cidade, ifsp, noroeste, tempo;cultura;;tempo;;;cidade, educação, ifsp, noroeste, tempo;cidade, cultura, educação, grande, sociais, ética;ifsp, mundo, relato, tempo;cidade, mulheres;básica, educação, educação básica;cultura, educação, ifsp, ética;política;mulheres;century;ifsp;cidade;;;básica;;mundo, relato;acesso, acesso permanência, básica, básica noroeste, cidade, discussões, discussões acesso, educação, educação básica, noroeste, noroeste paulistano, observatório, observatório políticas, paulistano, permanência, permanência educação, políticas, políticas públicas, públicas, públicas discussões;gênero, políticas;relato;educação;cidade, educação, políticas, políticas públicas, públicas, sociais;;;ifsp, âmbito;;básica;acesso, acesso permanência, básica, básica noroeste, discussões, discussões acesso, educação, educação básica, noroeste, noroeste paulistano, observatório, observatório políticas, paulistano, permanência, permanência educação, políticas, políticas públicas, públicas, públicas discussões;ifsp, relato;feminino, mundo, projeto, relato;grande, política, pública, âmbito;;;;acesso, cidade, cultura, educação, ifsp, políticas, projeto, redes, redes sociais, sociais;cidade, ifsp, projeto
Ana Claudia Folha da Cruz;análise;;;análise;análise;;gênero, periferia;;;possibilidades;;;;;;;análise, desafios;análise;;;;;análise, ciência;análise, possibilidades;;;;;desafios;estratégia;análise, estratégia;desafios, estratégia;desafios, pedagógicas;;;;;;análise;;;análise;;análise, ciência, desafios;;;;luta;análise;;;ciência;desafios, discussão;;análise;análise, desafios;;desafios;;desafios;discussão;;;;;;;análise;;estratégia;ciência;gênero, luta, possibilidades;;análise;desafios, estratégia;;;;;;;análise;estratégia;;;;;análise, estratégia;análise, estratégia
Ana Márcia Lima Costa;;;ensino, ensino médio, médio;ensino;educação;educação;educação, públicas;;;ensino, estudantes, pandemia, reflexões;;;;;;educação;impactos, impactos pandemia, pandemia;educação, estudantes;;;reflexões;;;ensino, ensino médio, médio;;;ensino;ensino, escolas, técnicas;;;;públicas;ensino, reflexões;;ensino;;ensino, públicas;;impactos;estudantes;ensino, escolarização;educação, ensino, estudantes;;educação, ensino, estudantes, públicas;;;;possíveis;;;;pandemia;;;educação, ensino, escolas, pandemia;cursos, educação, escolas, impactos, profissional;ensino, pandemia;ensino;educação, ensino;cursos, educação;;;;;;;;técnicas;;ensino;educação, ensino, ensino médio, médio, públicas, reflexões;ensino, impactos;possíveis;educação, ensino, reflexões;educação, impactos, públicas;;;;;;educação, públicas;ensino;;técnicas;;cursos, reflexões;;educação, impactos;
Ana Paula Rodrigues Magalhães de Barros;system;;ensino, matemática;ensino, teaching;produção;;livro, âmbito;possibilidades;ensino, estudantes, pandemia, reflexões;;learning, system;;;;;brazilian;pandemia, práticas;avaliação, docente, estudantes, learning, práticas;context, learning;;reflexões;;escola, olhar, partir, sob;ensino, formação, investigação, matemática, possibilidades, potencialidades, professores, provas;brazilian;;ensino, matemática;ambiente, brazilian, digital, ensino;campus, digital;digitais, digital, experiência, formativa, investigação, método, tecnologias, tecnologias digitais;digital, produção;digital, high, perspective;cenário, digitais, ensino, escola, professor, práticas, reflexões;;ensino, formação, professores;;avaliação, contexto, digitais, docentes, ensino, experiência, experiência programa, formação, matemática, olhar, professores, programa, tecnologias, tecnologias digitais;complex, digital, pedagógica;brazilian, digital, programa, tecnologias;deficiência, escola, estudantes;campus, culturais, didático, digitais, digital, ensino, formação, livro, livro didático, professor, práticas;campus, didático, ensino, estudantes, produção, programa;context, método, understanding;contribution, ensino, estudantes, experiência, formação, método, professores, prática, práticas, realidade;;;;contexto, digitais, digital, escola, paradigma, partir;campus;partir, produção;cenário, contexto;digital, experiência, pandemia;experiência, produção, tecnologias;system;avaliação, brazilian, campus, ensino, pandemia;avaliação, formação;campus, ensino, experiência, formação, método, pandemia, professores;disciplina, docentes, ensino, partir, práticas;docente, ensino, formação;avaliação, brazilian, campus, estudante, high, high school, perspective, pessoa, school, system;experiência;;perspective;avaliação, high, system;contribution, paradigma, partir, produção, system;;;;;complex, digital, ensino, experiência, pedagógica;docente, ensino, professor, realidade, reflexões;culturais, ensino, formação, partir, possibilidades, produção, sob;digitais, experiência, tecnologias, tecnologias digitais;contexto, ensino, matemática, matemática reflexões, olhar, professor, professores, práticas, práticas professores, reflexões;cenário, digital, internet;;;campus, pibid, âmbito;;;;campus, ensino, experiência, produção;experiência, learning, método;sob, âmbito;experiência;docente, olhar, reflexões;;avaliação, campus, context, contexto, digital, perspective;digital, formação
André Luiz Favareto;ambientes, system;;;management;;;;;;learning, system;;;;;;integrated;literatura;learning, literatura, revisão, revisão literatura;learning;;;;;aprendizagem;;;;aprendizagem;management;;revisão;;ambientes, aprendizagem, literatura;;;;;;management;aprendizagem;literatura;aprendizagem;literatura, revisão;literatura, revisão;;;literatura;aprendizagem;;;expression;;;system;literatura, management, revisão, revisão literatura;literatura, revisão;literatura;;;management, management system, system;;;;system;literatura, management, revisão, system;;literatura;aprendizagem;;literatura, revisão, revisão literatura;;;;;;;;;;;;;learning;;;literatura;;;
Andréa Antonieta Cotrim Silva;;;;;;;feminino;;;;;;;;;;;feminino;;feminino;;;;;;;;;;feminino;;;atual;;brasileiro;;;pensamento;brasileiro;;crítico, letramento;brasileira;;;;;;brasileiro;;;;;;;;governo, letramento;governo;;;brasileiro;;;;;;;;;;pensamento;;brasileiro;;;;;;;;;;;feminino;brasileiro;brasileira, governo;;;;
Ariane Macedo Melo Ferraz;;;;;educacional;;;;;;;;;;;;;;;;;;;;;;;educacional;;percepções;;;línguas;;;;educacional;complexo;educacional;;;;;contribuição, educacional;;;;;contribuição;;;;;;contribuição, educacional;;;;;;;;;;;;;;;complexo, línguas;;;;;;;;;;;;;percepções;design;;;;;
Beatriz Ferraz Diniz;;;;;;;;;;;;;;;;;;;;;;;;;;;;;;;;;;;;;;;;;;;;;;;;;;sp;;;;;;sp;;;;;;;;;sp;;;;;;;;;;;;;;;;;;;;;;;;
Bruno Secco Faquin;;;;;;;;;;;;;;;;;;;;;;;;;analysis;;;analysis;;;;;;;;;;;analysis, prediction;;;;;;;;;;;;;;;;analysis;;;;;;;;;;;analysis;;;;;;;;;;;;;analysis;;;;ball, soccer;analysis;;;;;
Bruno Sérgio do Amaral;cell;;;evaluation, magnetic;educação;educação;educação, ifsp;;educação;brazilian;integrated;;;;;;;educação;;câmpus, câmpus paulo, ifsp, paulo, paulo pirituba, pirituba;;evaluation;;;brazilian, plant;;;brazilian;paulo;paulo;;evaluation, new, paulo;;;conceito;paulo;paulo;;assessment, brazilian, paulo;;ifsp, paulo;educação, implementação;paulo;ambiental, diagnóstico, educação, educação ambiental;;;;;câmpus, câmpus paulo, ifsp, ifsp câmpus, paulo, paulo pirituba, pirituba;crude;;;conceito;evaluation;ambiental, assessment, brazilian, coleta, coleta seletiva, câmpus, câmpus paulo, diagnóstico, diagnóstico implementação, educação, educação ambiental, efeitos, ifsp, ifsp câmpus, implementação, implementação educação, paulo, paulo pirituba, pirituba, pirituba diagnóstico, seletiva, seletiva ifsp;diagnóstico, educação, efeitos, pirituba;ifsp;paulo;câmpus, câmpus paulo, educação, paulo, paulo pirituba, pirituba;brazilian, educação, ifsp, paulo, pirituba;paulo;;;câmpus, câmpus paulo, ifsp, ifsp câmpus, paulo, paulo pirituba, pirituba;new, paulo, period;;;paulo, via;efeitos;;educação, paulo;;;educação;educação, paulo;;;ifsp;harvesting, synthesis;;educação;ifsp, pirituba;;diagnóstico, implementação;;paulo;;conceito, educação, evaluation, ifsp, paulo, pirituba;ifsp, paulo, pirituba
Bárbara Beatriz Freitag;análise;;;análise;análise, gestão;;mulheres;análise, desafios;impactos, impactos pandemia, pandemia;pandemia, práticas;literatura;;;;;;;análise, características, literatura, práticas;;;;;análise;análise, áreas;;;;;desafios, gestão;conhecimento;análise, gestão;conhecimento, desafios, gestão;conhecimento, desafios, literatura, práticas;;;;;;análise, gestão, impactos, trabalho;;literatura, práticas;análise;literatura;análise, desafios, gestão, literatura, mulheres, práticas, trabalho;corporativas;;literatura;;análise, áreas;;;gestão, pandemia;desafios;;análise, diferentes, literatura, pandemia, áreas;análise, conhecimento, desafios, gestão, impactos, literatura;literatura, pandemia;desafios, mulheres, práticas;;desafios, gestão, trabalho;;mulheres;;áreas;gestão, literatura, trabalho;;literatura;análise;;conhecimento, literatura;trabalho;impactos, trabalho;;análise, práticas;desafios, gestão, impactos;;;;;;;análise, conhecimento;conhecimento;gestão, trabalho;;literatura, trabalho;;análise, brasileiras, conhecimento, gestão, impactos;análise, brasileiras, brasileiros, conhecimento, gestão
Carolina Aparecida de Freitas Dias;análise;;;análise;análise, brasil, educação;educação;educação, feminino, políticas;análise;educação, estudantes;avaliação, docente, estudantes, learning, práticas;learning, literatura, revisão, revisão literatura;feminino;;;;educação;análise, características, literatura, práticas;;learning;feminino;;;análise, proposta;análise, desenvolvimento, estudo;;;;estudo;caso, desenvolvimento, estudo, estudo caso;brasil, caso, desenvolvimento, feminino;análise, brasil, caso, curso, estudo, revisão;brasil, caso, estudo, estudo caso, perspectivas, políticas;literatura, perspectivas, práticas;caso;;;avaliação, curso, estudo, políticas, proposta;;análise, caso, estudo, estudo caso, organizacional, vida;estudantes, estudo;literatura, perspectivas, práticas;análise, desenvolvimento, educação, estudantes, vida;literatura, revisão;análise, brasil, desenvolvimento, educação, estudantes, estudo, humanos, integrativa, literatura, políticas, práticas, resultados, revisão, revisão integrativa;competências;;literatura;brasil, caso, estudo, estudo caso, humanos, proposta, recursos;análise;;caso, estudo, estudo caso;;estudo;;análise, avaliação, brasil, caso, educação, estudo, estudo caso, literatura, revisão, revisão literatura;administração, análise, avaliação, brasil, educação, estudo, humanos, literatura, organizacional, revisão;curso, literatura;práticas;caso, docente, educação, proposta;administração, avaliação, brasil, cristo, curso, desenvolvimento, educação, estudo, organizações;brasil, caso;;;avaliação;caso, estudo, estudo caso, framework, influência, literatura, perspectivas, proposta, revisão;;literatura;análise, desenvolvimento;;literatura, revisão, revisão literatura;brasil, carreira, docente, educação, políticas, recursos;brasil, políticas;;análise, educação, práticas, vida;brasil, caso, educação, estudo, estudo caso, perspectivas, políticas, proposta;;;curso;;caso, curso, estudo, estudo caso;educação, políticas;análise, curso, recursos;feminino, framework, learning;caso, desenvolvimento, estudo, estudo caso, fatores;perspectivas;carreira, docente, literatura;;análise, avaliação, brasil, caso, desenvolvimento, educação, estudo, estudo caso, organizacional, políticas, proposta;análise, brasil, estudo, perspectivas
Caroline Inês Lisevski;;;;simulador;;;;;;context, learning;learning;;;;;;;learning;;;;production;;smartphone;;;;;;;;performance;;;;;;;performance, research, science;;;;brazil, context;;;;;online;;hydrogen, production;;;;performance;brazil;;;;;brazil, performance;;;;;;;;;;;;;;;;;;;hydrogen, performance;;;;learning, research;brazil;;;;brazil, context, online, sharing;
Claudia Almerinda de Souza Oliveira;aplicação;;;;;;feminino, ifsp;;;;;feminino;;;;câmpus, câmpus paulo, ifsp, paulo, paulo pirituba, pirituba;;feminino;;;;;;;;;;aplicação, artificial;paulo;aplicação, através, através geração, feminino, feminino através, geração, geração renda, paulo, perspectiva, renda;estoque;controle, paulo;;;;paulo;paulo;;geração, paulo;;ifsp, paulo;;paulo;aplicação, geração, perspectiva, renda;;;;;câmpus, câmpus paulo, ifsp, paulo, paulo pirituba, pirituba;aplicação, geração;;artificial, controle;;;câmpus, câmpus paulo, ifsp, imagens, paulo, paulo pirituba, pirituba;pirituba;ifsp;imagens, paulo;câmpus, câmpus paulo, paulo, paulo pirituba, pirituba;artificial, ifsp, paulo, pirituba;paulo;;;câmpus, câmpus paulo, ifsp, paulo, paulo pirituba, pirituba;controle, paulo, perspectiva;;;aplicação, paulo;;perspectiva;paulo;;;perspectiva;controle, paulo, perspectiva;;;ifsp;;;;ifsp, pirituba;aplicação, artificial, através, através geração, feminino, feminino através, geração, geração renda, neural, perspectiva, renda;aplicação, através, estoque, perspectiva, renda;;paulo;;controle, ifsp, paulo, perspectiva, pirituba;controle, ifsp, paulo, pirituba
Danilo Marcondes de Alcantara;;;;;;;violência;;reflexões;reflexões;;;;;;;;;;;;;;;;;;;;;;;reflexões;;;;;;;;;;;acerca;;;;;;;;;;;;;;;;;;;;;pr;;;acerca;;;reflexões;;;reflexões;;;;;;;;;;;;reflexões;;;
Davi Munhoz Benati;;;;evaluation;;;;;;;;;;;;evaluation;;;production;;;;;;study;;;;;;;evaluation;;;;;;;investment, study;;;;;;;;;;;process, production;;;;evaluation;study;;;;;study;;;;study;;observation, phase, thermodynamic;;study;;;;;;;;;study;;;;;;study;phase, study;;;;evaluation, study;
Elisangela Lizardo de Oliveira;análise;;;análise;análise;;projeto;análise, ciência;;escola, olhar, partir, sob;;;;;;;análise;análise, proposta;;;;;;análise;;;;;projeto;projeto;análise;projeto;escola;;;;olhar, proposta;;análise, satisfação;escola;;análise, projeto;;análise, científica, ciência;;;;escola, partir, proposta;análise;partir;;ciência;;;análise;análise;;partir;proposta;;;;;;partir, proposta;;;análise, divulgação;;;ciência;partir, sob;;análise, olhar;proposta;;;;;;;análise;projeto;sob;;olhar;;análise, projeto, proposta;análise, projeto
Emanoel Fabiano Menezes Pereira;análise;;ensino, ensino médio, matemática, médio;análise, aspectos, ensino;análise;construção;;análise, possibilidades;ensino, ensino médio, médio;ensino, formação, investigação, matemática, possibilidades, potencialidades, professores, provas;aprendizagem;;;;;;análise, áreas;análise, desenvolvimento, estudo;smartphone;;;;análise;;processos;;ensino, matemática;aprendizagem, ensino, estudo, uso;desenvolvimento, estudo;construção, desenvolvimento, investigação, uso;análise, estudo;estudo;aprendizagem, construção, ensino, ensino aprendizagem;;ensino, formação, professores;;ensino, estudo, formação, função, funções, ingressantes, matemática, professores, professores matemática, uso, área;;análise, estudo, processos, uso, área;aprendizagem, estudo;construção, ensino, formação;análise, aprendizagem, desenvolvimento, dificuldades, ensino;;análise, co, construção, desenvolvimento, ensino, estudo, formação, formação inicial, inicial, processos, professores;;;;aprendizagem, estudo;análise, elaboração, espacial, áreas;processos;estudo, uso;questão, questões;estudo, uso;;análise, compreensão, elaboração, ensino, espacial, estudo, áreas;análise, estudo, formação, processos, uso;construção, ensino, formação, professores, questões;ensino;ensino, formação, questão;construção, desenvolvimento, estudo, uso;;;;áreas;construção, estudo, uso;;;análise, aprendizagem, desenvolvimento;;construção, ensino, uso;ensino, ensino médio, médio;atividade, ensino, formação, possibilidades;uso;análise, ensinando, ensino, matemática, professores, professores matemática, resolução;estudo;;;construção;;estudo;;análise, análise uso, construção, ensino, uso, área;construção, uso;desenvolvimento, estudo;;;;análise, atividade, construção, desenvolvimento, estudo, interação, uso;análise, estudo, formação
Eudes Müller D'Oliveira Santos;;;;;sistema;;;;;brazilian;;;;;analysis;brazilian, plant;;;;;;study;;processos;;;;analysis, brazilian, utilizando;sistema;;sistema, utilizando;;;;;;utilizando;auxiliar, utilizando;analysis, brazilian, processos, scenario, study;;;;;processos, utilizando;;;;;utilizando;processos, utilizando;;;sistema;;analysis, brazilian, sistema, study, temperatura, utilizando;processos;;;;brazilian, study, utilizando;;;;study;sistema, utilizando;analysis;;sistema, study;;auxiliar, utilizando;;;;;;;study, test;;analysis;;;;comparative, comparative study, result, scenario, study;analysis, study, utilizando;;;utilizando;sistema, study;
Eufrida Pereira da Silva;;;;;;;;;;;;;;;;;;;;;;;;;;;;;;;;;;;;;;;;;;;;;;;;;;;;;;;;;;;;;;;;;;;;;;;;;;;;;;;;;;;;;;;;;
Everaldo Paulo da Silva;;;cálculo, ensino, matemática;ensino;;;;;ensino;ensino, matemática;;;;;;;;;;;;;;ensino, matemática;;;;ensino;;;;;ensino;;ensino;;ensino, matemática;;;;ensino;ensino;;ensino;;;;;;;;;;;ensino;;ensino;ensino;ensino;;;;;;;;;;;ensino;ensino;ensino;;ensino, matemática;;;;;;;;ensino;;;;;;;
